{
  "agent": "validation",
  "programm": "nextcloud",
  "overall_pass": false,
  "kategorien": {
    "A_identity": { "pass": true, "note": "Images fixiert, Arch passt, Ports konsistent. OIDC-Redirect-URI definiert aber keine Traefik-Route dafuer." },
    "B_routing": { "pass": false, "issues": ["WebSocket: Spec=false, UserInput=true → Nextcloud braucht WS fuer Notify", "Middleware-Namensdrift (redirect vs redirectScheme)", "OIDC-Route fehlt in Traefik-Konfiguration"] },
    "C_persistence": { "pass": true, "issues": ["Volume-Mount-Reihenfolge bei ueberlappenden Pfaden unsicher", "Redis-Persistenz nicht explizit dokumentiert"] },
    "D_dependencies": { "pass": true, "note": "Startup-Order korrekt, Readiness-Gates vorhanden, keine Zyklen." },
    "E_health": { "pass": true, "note": "Healthchecks plausibel, Restart-Policy definiert, Deploy wiederholbar." },
    "F_config": { "pass": true, "issues": ["DB-User/DB-Name nicht explizit in env.template", "Redis-Passwort-Integration unvollstaendig", "OIDC-Konfiguration zu vage"] },
    "G_backup": { "pass": false, "issues": ["Keine Backup-Strategie definiert", "Kein Restore-Verfahren dokumentiert", "Rollback ohne DB-Snapshot"] }
  },
  "fehlerliste": [
    {"severity": "high", "text": "WebSocket-Support inkonsistent — Nextcloud braucht WS fuer Notify/Push", "fix": "Spec websocket auf true setzen; Traefik fuer WebSocket-Upgrades konfigurieren"},
    {"severity": "high", "text": "OIDC-Redirect-Route fehlt in Traefik-Konfiguration", "fix": "Middleware fuer /apps/sociallogin/custom_oidc/redirect ergaenzen"},
    {"severity": "high", "text": "Keine Backup-Strategie fuer DB+Volumes", "fix": "pg_dump-Cronjob, Volume-Snapshots vor Deploy, Restore-Reihenfolge dokumentieren"},
    {"severity": "medium", "text": "Middleware-Namensdrift (redirect vs redirectScheme)", "fix": "Namen in docker-compose-Labels und traefik-dynamic.yml vereinheitlichen"},
    {"severity": "medium", "text": "Volume-Mount-Reihenfolge bei ueberlappenden Pfaden", "fix": "Spezifischere Pfade NACH uebergeordneten mounten"}
  ],
  "next_actions": [
    {"priority": 1, "action": "OIDC-Route+Middleware in Traefik-Konfiguration ergaenzen"},
    {"priority": 2, "action": "WebSocket-Support in Spec korrigieren und Traefik konfigurieren"},
    {"priority": 3, "action": "Middleware-Namen vereinheitlichen"},
    {"priority": 4, "action": "Backup-Strategie definieren (pg_dump + Volume-Snapshots)"},
    {"priority": 5, "action": "Volume-Mount-Reihenfolge in docker-compose.yml validieren"}
  ]
}
